activity_id	activity_name	activity_url	activty_dates	activity_times	activty_place	activity_district	activity_address	activity_description
198	Planetario Galileo Galilei	https://disfrutemosba.buenosaires.gob.ar/lugares/planetario-galileo-galilei	{'Miércoles', 'Viernes', 'Jueves', 'Martes', 'Sábado', 'Domingo'}	{'12:00 a 19:30', '09:30 a 17:00'}	Patrimonio	Palermo	Av. Sarmiento s/n, C1425 CABA, Argentina	El Planetario es el principal centro de divulgación de astronomía de la ciudad. Cuenta con una sala de proyección semiesférica con trescientas sesenta butacas reclinables y una cúpula de veinte metros de diámetro donde se reproducen cerca de 8.900 estrellas, planetas y satélites del universo, gracias a un imponente equipo (único en Latinoamérica) que contiene seis proyectores Sky-Skan con resolución 8K, lo que indica que el domo contiene 38 millones de píxeles.Su edificio de cinco pisos también cuenta con un museo y una pequeña sala de proyección secundaria, además de albergar una colección de meteoritos provenientes del norte argentino. En el lago adyacente se encuentra la escultura Sorprendida, del italiano Nicolás A. Ferrari y, a pocos metros, un monolito evocativo del sabio polaco Nicolás Copérnico.Visitas guiadas del sábado 16 al domingo 31 de julio.Lunes miércoles y viernes&nbsp; 11 h.Sábados y domingos 10 y 11 h.TELESCOPIOS del sábado 16 al domingo 31 de julio.Actividad gratuita con cupo de 250 observadores&nbsp;Miercoles, sábados y domingos al anochecer.
219	Buenos Aires Market	https://disfrutemosba.buenosaires.gob.ar/lugares/buenos-aires-market	NULL	NULL	NULL	NULL	NULL	Vuelve la feria “Buenos Aires Market” para perfumar Villa Urquiza con aromas de los platos más ricos para disfrutar en su Patio de Comidas. Además, en el Mercado de Productores tendrás una enorme variedad de productos para tus compras de la semana.En el patio de comidas hay opciones para todos los paladares: paella, hamburguesas, rabas, tortillas, crepes, arepas, tequeños, shawarma, carnes braseadas, langostinos al ajillo, helados, licuados, café de especialidad, patisserie, picadas, cocina vegana y opciones sin tacc, entre otras propuestas. En el mercado, directo de los productores, podés encontrar quesos, embutidos, mermeladas, dulces regionales, infusiones, panificados, chocolates, hongos, conservas, mieles, especias, aderezos, productos de bazar y mucho más.Sábado 30 y domingo 31 de julio | 10 a 18hPlaza Echeverria (Pedro Rivera y Av. Triunvirato, CABA)Entrada gratuita+ info en instagram.com/bsasmarket
239	OTBA en Usina del Arte	https://disfrutemosba.buenosaires.gob.ar/lugares/otba-en-usina-del-arte	NULL	NULL	Museos y Galerías	NULL	NULL	El viernes 5 de agosto La Orquesta del Tango de Buenos Aires dará un nuevo concierto con un repertorio especial de clásicos del tango. Canta Lautaro Mazza y la conducción estará a cargo de la periodista y locutora Mariana Fossati. Dirige a la Orquesta los Mtros. Néstor Marconi y. Juan Carlos Cuacci.Viernes 5 de agosto | 20hUsina del Arte | Agustín R Caffarena 1, Esq. Pedro de MendozaEntradas gratuitas | disponibles desde el 2 de agosto haciendo click acá--------------------------------------------La Orquesta del Tango de Buenos Aires nació en 1980. Está dirigida por los Maestros Néstor Marconi y Juan Carlos Cuacci. Premios: Disco de Oro por En vivo en el Colón (2001), Diploma al Mérito Fundación Konex como Conjunto de Tango (1995 y 2005). Nominaciones a los Grammy Latinos 2011 por sus trabajos 30 Años. Nominaciones a los Grammy Latinos 2011 por sus trabajos 30 años y Homenaje a Cátulo Castillo y Aníbal Troilo; Grammy Latino como Mejor álbum de tango 2015 y el Premio Carlos Gardel, como Mejor álbum de orquesta instrumental 2016, ambos reconocimientos por Homenaje a Astor Piazzolla, su último trabajo editado.
271	Estación Retiro	https://disfrutemosba.buenosaires.gob.ar/lugares/estacion-retiro	NULL	NULL	Transporte	Retiro	Av. Dr. José María Ramos Mejía 1430, C1104 CABA, Argentina	NULL
291	Torneo de Beatbox	https://disfrutemosba.buenosaires.gob.ar/lugares/torneo-de-beatbox	NULL	NULL	Espectáculos	NULL	NULL	¡Llega una nuva edición del Duelo de parlantes! Un Torneo organizado por Beatbox Argentina. Los participantes medirán su talento en dos fechas imperdibles. El beatbox, cuya traducción significa “caja de ritmos”, es una disciplina en la que se usa la boca y los labios para producir ritmos y sonidos musicales, generalmente de instrumentos de percusión como batería, bombo, caja y platillos.&nbsp;El beatboxing permite crear un patrón rítmico para rapear arriba sin necesidad de tener un reproductor musical. Su vinculación con la cultura hip hop viene desde los años 80, aunque la percusión vocal es un arte muy antiguo.Domingo 24 de julio&nbsp;| Duelo de parlantes 5° edición | 15 h | Patio del AljibeDomingo 21 de agosto | Duelo de parlantes 6º edición | 15 h | Patio del AljibeEntrada gratuita. Se reprograma por lluvia&nbsp;&nbsp;
299	Puerto Madero	https://disfrutemosba.buenosaires.gob.ar/lugares/puerto-madero	NULL	NULL	Parques y Plazas	Puerto Madero	Puerto Madero, CABA, Argentina	NULL
305	Av de Mayo	https://disfrutemosba.buenosaires.gob.ar/lugares/av-de-mayo	NULL	NULL	Parques y Plazas	Montserrat	Av. de Mayo & Bolívar, C1059 CABA, Argentina	NULL
315	Facultad de derecho	https://disfrutemosba.buenosaires.gob.ar/lugares/facultad-de-derecho	NULL	NULL	Espectáculos	Recoleta	Av. Pres. Figueroa Alcorta 2263, C1425CKB CABA, Argentina	NULL
