activity_id	activity_name	activity_url	activty_dates	activity_times	activty_place	activity_district	activity_address	activity_description
532	Agosto en el EC Julian Centeya	https://disfrutemosba.buenosaires.gob.ar/lugares/agosto-en-el-ec-julian-centeya	NULL	NULL	Centros culturales	NULL	NULL	Las Marias: Asociacion Civil 7 coloresEsta obra de teatro trata la vida de dos hermanas que se reencuentran en un lugar indefinido. Sus historias estan atravesadas en sus relatos, con recuerdos de sus infancias y adolescencias. Un padre patriarcal las vincula al mandato de ser mujer. El perdon a una madre y la muerte inesperada por un femicidio las hara entretejer nuevos desafios con la esperanza de encontrar la libertad anorada.Esta obra esta inspirada en mujeres que fueron victimas de violencia de genero. Donde el poder se construye en estructuras de techos de cristales que repercuten en la vida de cuerpos femeneizados. Un arduo trabajo de mirada interseccional vincula al espectador a una profunda reflexion de los privilegios adquiridos y los derechos que faltan conquistar para las mujeres, travestis, lesbianas y trans, ¿La sororidad sera el unico destino?Viernes 5 de agosto | 20:30hOrquesta de tango de la UNA + Quinteto de los ReyesLa Orquesta de Tango de la UNA, dirigida por Ariel Pirotti, esta integrada por estudiantes y musicos muy jovenes, e intenta evocar la sonoridad de las grandes orquestas tipicas que florecieron en los anos dorados del tango desde una estetica renovadora con sus arreglos e interpretaciones. Con su primer disco El Rejunte recibio el Premio Gardel como Mejor Nuevo Artista de Tango. Se presento en diversos escenarios portenos y fue nominada al Latin Grammy 2017.Formado en 2016 por Alejo de los Reyes, el Quinteto De los Reyes grabo el acompanamiento de los discos de Ruben Llaneza (cantor de la orquesta de Joaquin Do Reyes en la decada del 50) y Paula Serrano. Participo de varios importantes eventos, entre los que se destaca su concierto en el Festival Buenos Aires Tango 2018. Actualmente se encuentra registrando su primer disco instrumental, con nuevas versiones de tangos clasicos y algunas composiciones originales.Sabado 6 de agosto | 21hGushiEl diabolo es un invento milenario de origen chino. Se utilizaba tiempo antes de Cristo para ahuyentar malos espiritus. Brunitus recupera este origen mistico en su nuevo espectaculo para generar un viaje. Un viaje por las emociones humanas a traves de este elemento que gira, da saltos y se enreda, como nuestras historias.Gushi es una fabula circense. Una propuesta poetica e intensa. Un espectaculo para toda la familia.Domingo 7 de agosto | 17hLucia D’Agostino en Concierto: Cantando HistoriasLa cantante homenajea a Carlos Gardel compartiendonos un repertorio variado, acompanada por Shino Onhaga en piano y Olga Talero en violin.Viernes 12 de agosto | 20hEspacio Cultural Julian Centeya - Av. San Juan 3255Entrada gratuita
554	Folclore en casa	https://disfrutemosba.buenosaires.gob.ar/lugares/folclore-en-casa	NULL	NULL	NULL	NULL	NULL	La tercera temporada, conducida por Mariana Bocca que podra verse los domingos a las 21 horas por el canal de la Ciudad y por la plataforma Vivamos Cultura, llega renovada. Este ano, cada emision se filmara en una pena o espacio dedicado al folklore en la Ciudad de Buenos Aires o del conurbano. Una vez mas los entrevistados seran artistas reconocidos del folklore argentino como: Zamba Quipildor, Aldy Balestra y el trio Tupa, Sant2, el Condor Sbarbati, La Fortunata (Guadalupe Fleitas y Sebastian Farias Gomez), Nancy Abalos, Caro Centurion, Ffanco Luciani, Nahuel Pennisi y el Chango Spasiuk.Por “Folklore en Casa” ya pasaron figuras de la talla de: Antonio Tarrago Ros, Marian Farias Gomez, Belen Jaramillo, el Indio Rojas, Carlos Di Fulvio, Lorena Astudillo, Jose Luis Castineira de Dios, la Negra Chagra y Pancho Figueroa, entre otros. Y en su tercera edicionpromete seguir resaltando y visibilizando la importancia de este arte federal que es parte de nuestra cultura.Sobre el programa“Folklore en casa” surge de un convenio firmado el 22 de agosto de 2020, Dia del Folklore, entre el Ministerio de Cultura de la Ciudad y la Academia Nacional del Folklore, De esta manera, el Ministerio de Cultura, a traves de su programa Cultura Federal, y el Canal de laCiudad se proponen difundir nuestro arte folklorico a traves de sus mas variados referentes. El Canal de la Ciudad se emite por Cablevision 7– 515 (Flow), Telecentro 22(Digital) – 71, Intv 27, Red Intercable 401 (Digital), DirecTV 239.
564	Presentaciones de libros	https://disfrutemosba.buenosaires.gob.ar/lugares/presentaciones-de-libros	NULL	NULL	Espectaculos	NULL	NULL	Libros creados por pensadores, creadores, artistas que inspiran la creatividad, el vinculo con las artes, el descubrimiento de vocaciones, los cruces y mezclas de disciplinas y estilos, la experimentacion, el conocimiento de diferentes lenguajes creativos, la cultura libre, sustentable y colaborativa. Durante Mayo y Junio, en CC Recoleta se presentaran los siguientes libros:Mar. 26.07 El tiempo de Isidro de Nico Mendoza | 18 h | Sala 6Sab. 30.07 Proyectos de Fanzine, Novela grafica y Libro Album | 15 h | Patio de los NaranjosMar. 02.08 Esencia de cada alma de Franco Avolio | 19 h | Sala 6
565	Lecturas Performaticas	https://disfrutemosba.buenosaires.gob.ar/lugares/lecturas-performaticas	NULL	NULL	Espectaculos	NULL	NULL	La vinculacion de estas artes y el texto escrito genera creaciones performaticas: lecturas que suceden entre videoinstalaciones y musica. Poetas que escriben desde la incertidumbre. Textos que se hacen sonoros, visuales, tangibles. Durante los meses de Mayo, Junio y Julio se llevaran a cabo las siguientes lecturas performaticas en CC Recoleta:&nbsp;Jue. 11.08 La guerra suave. Karaoke poetico organizado por Malena Saito y Florencia Del Castillo | 19 h | Patio del Aljibe&nbsp;Dom. 21.08&nbsp; Auto Cine organizado por Colectivo 17 | 18 h | CineJue. 08.09 Las venas comunicantes organizado por Flor Codagnone y Damo Munoz | 19 h | Patio del Aljibe
569	Pedaleando BA	https://disfrutemosba.buenosaires.gob.ar/lugares/pedaleando-ba	NULL	NULL	NULL	NULL	NULL	Pedaleando BA, es uno de los programas de Turismo en Barrios, los circuitos autoguiados organizados por el Ente de Turismo de la Ciudad de Buenos Aires. La propuesta es recorrer los barrios de la Ciudad con rutas al aire libre para hacer a pie o en bicicleta, y disfrutar de la gastronomia, el arte urbano, los comercios, los espacios verdes y los lugares mas emblematicos de cada uno.&nbsp;Mediante un mapa online, se pueden localizar una enorme variedad de puntos de interes: plazas, parques, rincones especiales, murales, clubes, edificios emblematicos por su arquitectura y diseno, comercios, su historia y mitos que marcan la impronta de cada barrio.CONOCE TODOS LOS RECORRIDOSCIRCUITO 1 | Caballito, Villa Crespo y ColegialesMezcla de tradicion con modernidad, pedalear por estos barrios te invita a conocer joyas arquitectonicas, sumergirte en el tango de Pugliese, perderte en el aroma a cafe de los Bares Notables que encontraras por el camino y detenerte a descansar en sus parques y plazasCIRCUITO 2 | Saavedra, Villa Urquiza y CoghlanPedalear por estos barrios te invita a conocer museos, parques, murales y la huella profunda de la presencia artistica en la figura del Polaco Goyeneche.CIRCUITO 3 | Coghlan, Belgrano y NunezEn la zona norte del mapa de la Ciudad, el Ferrocarril dejo su huella. En dos ruedas, vas a poder apreciar como conviven las casonas senoriales con construcciones muy modernas. Disfruta de sus espacios verdes, de las callecitas con historia y animate a conocer todos sus secretos.CIRCUITO 4 | Parque Chacabuco, Boedo y Parque PatriciosUna invitacion a asomarte a tu ninez, cuando jugabas en la vereda y todo era diversion. Calles empedradas, casas bajas, mucho arte urbano, rincones llenos de historia y espacios verdes para descansar en medio de la naturaleza. ¡A disfrutar!CIRCUITO 5 | PalermoUn barrio lleno de arte urbano y espacios verdes, como el Jardin Japones, plaza Italia y los parques Las Heras y Tres de Febrero. En el medio, vas a encontrar una buena cantidad de propuestas gastronomicas y un circuito de interesantes museos. ¿Vamos?CIRCUITO 6 | Recoleta y RetiroSon dos de los barrios mas emblematicos y con mayor cantidad de atractivos turisticos de la Ciudad. Desde las dos ruedas, vas a poder ver construcciones de gran valor arquitectonico, como el Teatro Colon, la Cancilleria o la Facultad de Derecho de la UBA. Tambien te encontraras con hermosos espacios verdes, entre ellos la plaza Lavalle, la plaza Francia y la plaza San Martin. Y, ademas, vas a pasar por una enorme variedad de museos, el de Bellas Artes o el de Arquitectura y Diseno, entre otros. Tambien vas a disponer de una buena cantidad de propuestas gastronomicas. ¡Que disfrutes del paseo!&nbsp;
573	Muestra de Artes Visuales	https://disfrutemosba.buenosaires.gob.ar/lugares/muestra-de-artes-visuales	NULL	NULL	Espectaculos	NULL	NULL	El Cultural San Martin invita a conocer las nuevas muestras visuales que se encontraran en exposicion:Asian-African-Mediterranean-European and Americas International Art Exhibition, por Luo Qi y Maria de la VegaInauguracion de una muestra internacional itinerante que no se ha limitado a ser expuesta unicamente en China y ha fortalecido su caracter internacionalista dando lugar a un profundo y hondo intercambio cultural. En ella, mas de 130 artistas provenientes de 58 paises presentan sus obras inscriptas en diversos lenguajes artisticos que, como afirma Maria de la Vega, construyen “una red atemporal que interpela nuestra comunicacion e incentiva a crear nuevos presentes”, tratandose de un testimonio y un recuerdo de la epoca de la pandemia en dialogo con los modos en que nuestra forma de percibir lo inminente y la adaptacion a lo inevitable han cambiado.Desde el 11 de agosto | 19h | Sale EJoyas del Delta - tecnologia espiritual, por Maja LascanoAdemas, el 20 de agosto, Maja Lascano ofrece una nueva activacion performatica de la presente instalacion textil, la cual se compone por esculturas blandas que fueron inspiradas en los colores, fauna y flora del Delta. Cada activacion es una oportunidad y un nuevo dialogo que se entabla segun como se perciba la hora y el dia en el entrepiso vidriado y de acuerdo a la interaccion producida entre la artista y el publico.En sintesis, Joyas del delta, tecnologia espiritual es una instalacion que se activa junto a la artista y lxs demas. Es un homenaje a la poesia de Juan L. Ortiz y a su ribera rosa y dorada. Y es, tambien, un proyecto que busca cambiar el paisaje del entrepiso marmoreo para volverlo mas “suave”, al menos por un rato.20 de agosto | 15h | Hasta diciembre | EntrepisoTambien, se podra recorrer las exposiciones de:La quinta pared, por Agustina AlazrakiEntre lo surreal y lo sublime del pensamiento pictorico, la artista presenta una serie de emociones receptadas a partir de lo onirico. Mediante vivencias noctambulas de lo etereo, recibe un llamado de lo mas recondito del inconsciente y recurre a el para expresar en figuras, formas y perspectivas, el camino hacia lo insondable e incognito.La quinta pared nos invita a transitar este mundo, nuestro propio mundo imaginario que vamos descubriendo a medida que observamos como propios protagonistas de momentos antagonicos y sin limites en la imaginacion de los suenos mismos.&nbsp;Hasta el 21 de agosto | EntresueloNi tan POPular, por Barbi ArcuschinLas relaciones que Barbi establece a traves de sus capturas muestran un lenguaje particular, artistico y documental con coordenadas espacio-temporales muy precisas, en donde aparecen personajes de muy variada indole. Muchas de estas personas no podrian pasar desapercibidas, pareciera que se desplazan entre lo cotidiano como si estuvieran en un escenario, pero otras, por el contrario, centellean su anonimato y ahi es donde la artista logra senalar con el lente algun detalle o nota que exhibe el rasgo particular que las identifica. A veces una mirada, otras un gesto exaltado. Asi, su busqueda se trata mas de un dialogo revisionista de los trazos de nuestro tiempo que de una cronica realista.&nbsp;Hasta el 21 de agosto | Hall ABMedio y medium, por Julieta Proto, Ines Deluca, Ampato Feito y Camila Julieta CaceresHacia dentro y hacia afuera, los trabajos de Deluca capturan imagenes de mundos que se alejan hacia lo desconocido. Parada en una membrana invisible, un ojo mira hacia los astros y las constelaciones lejanas, y el otro hacia el interior del magma germinal de nuestra tierra. En las pinturas de Caceres, las formas seductoras y atractivas que juegan con las representaciones de los cuerpos se encuentran con un universo geometrico restrictivo y convencional, como la del propio marco de una pintura, generando incomodidades visuales y conceptuales. La pintura de Proto se orienta a partir de recuerdos que, derruidos como si fuera un fresco antiguo, son restaurados por medio de lagunas tonalizadas y texturadas asi como por rellenos fantasiosos, produciendo un efecto pareidolico en quien la recibe. Por su parte, Feito se mueve con soltura entre los significantes y propone escenas que nos invitan a reflexionar en torno a los conductos detras de lo que el lenguaje articulado permite nombrar; una mesa de luz o un escritorio se convierten en laboratorio fenomenologico. Ante las obras aqui presentadas existe la posibilidad de asumir una posicion dialectica que se hamaca y se retroalimenta entre dos polos: la aceptacion de lo que se ve. una confianza ciega, y una actitud analitica que se abre al descubrimiento.Hasta el 21 de agosto | Sala Vertical¿Soy yo?, por Griselda Alvarez&nbsp;En esta muestra, compuesta por 32 dibujos realizados en acrilico, rotuladores y tinta sobre papel, la artista propone encontrarnos y perdernos con ella mediante un juego de miradas: ¿Soy yo?, me preguntas con sorpresa. Si claro, respondo, y soy yo tambien jugando a ser vos. Fragmentada, desordenada, tratando de juntar, de unir mi rompecabezas de caras, mi juego personal de acercar lo que todavia esta separado. Contar historias de instantes compartidos, de suenos, de amistad, de admirada admiracion. Unir, abrazar, apretar, dar la mano, volver a mirar. Espejar. Soy yo que te mira, sos vos que me miras.Hasta el 31 de agosto | Hall sala Enrique MuinoJueves a domingos | 15 a 21hEl Cultural San Martin | Sarmiento 1551Entrada gratuita
575	Centro Cultural Lola Mora	https://disfrutemosba.buenosaires.gob.ar/lugares/centro-cultural-lola-mora	NULL	NULL	Centros culturales	Caballito	Rio de Janeiro 946, C1414 CABA, Argentina	NULL
579	Ecobici	https://disfrutemosba.buenosaires.gob.ar/lugares/ecobici	NULL	NULL	NULL	NULL	NULL	El primer sistema de bicicletas publicas de la Argentina se inauguro con tres estaciones con atencion personalizada, 72 bicicletas y alrededor de 100 viajes diarios. Hoy tiene 280 estaciones automaticas en 47 barrios y esta disponible las 24 horas, los siete diasde la semana.Ecobici es gratuito para todas las personas residentes del pais de lunes a viernes (dias habiles) con hasta cuatro viajes de 30 minutos cada uno. Si queres utilizar las bicis los fines de semana o pedalear por mas tiempo, podes conocer los nuevos pases que ya estan habilitados. Si sos turista extranjero y queres usar Ecobici tenes que obtener un pase turistico exclusivo. Conoce los nuevos pases aca.Elegi tu pase a traves de la app para empezar a pedalear.Acercate a una estacion. Genera un codigo a traves de la app e ingresalo en el anclaje de la bici que quieras retirar. Espera la luz verde y retira la bici tomando el manubrio con una mano y levantando el asiento con la otra.Devolve la bici en cualquier estacion. Ancla la bici en un espacio libre, levantandola para trabarla correctamente en la ranura. Espera la senal sonora y la luz verde que confirman la correcta devolucion de la bicicleta.Todas las dudas que tengas del sistema podes consultarlas en&nbsp;BA Ecobici Preguntas FrecuentesMas informacion www.buenosaires.gob.ar/ecobici/sistema-ecobici
592	Food Fest	https://disfrutemosba.buenosaires.gob.ar/lugares/food-fest	NULL	NULL	Centros culturales	NULL	NULL	Food Fest propone un nuevo espacio para el encuentro de comidas y sabores, rescatando las principales tendencias gastronomicas de la escena local: la cocina de ahumados, el ramen y los sabores asiaticos, la culinaria plant based, el cafe de especialidad, la patisserie de autor, los revalorizados sabores regionales, las carnes nobles, el sazon latino, los panificados naturales, la fusion escandinava, la charcuterie y el comfort food.El festival llega con una variada oferta de platos para fanaticos de la gastronomia, con precios accesibles y maxima calidad. Las cervezas artesanales, las bebidas premium y la cocteleria tambien tendran presencia destacada.Contara con entretenimientos para ninos y adultos, y clases de cocina a lo largo de las jornadas.6 y 7 de agosto | 12 a 20 h | La Rural (Av. Sarmiento 2704)&nbsp;
599	Ventanilla Fija	https://disfrutemosba.buenosaires.gob.ar/lugares/ventanilla-fija	NULL	NULL	NULL	NULL	NULL	Llega la primera edicion de Ventanilla Fija, un programa de asesoramiento legal y gratuito dirigido exclusivamente a hacedores de la industria del sonido.El programa tiene como objetivo brindar asesoramiento legal integral en lo relativo a derechos musicales de autores/compositores, interpretes y productores fonograficos, contratos en la industria musical y derecho de entretenimiento a proyectos musicales y/o sonoros emergentes en todo el territorio de la Republica Argentina. Esta iniciativa estara abierta desde el 1 de junio hasta el 30 de noviembre para cualquier persona con un proyecto sonoro que desee recibir asesoramiento legal. El mismo consta de un encuentro virtual de una duracion aproximada de cuarenta y cinco minutos con una profesional en la materia quien asesorara de manera gratuita y particular. Para autores/compositores, interpretes y/o productores fonograficos, el programa servira para saber cuales son los derechos como musico/a independiente, entender como son los procesos de registro, que implicancias tienen los contratos firmados y muchos otros aspectos legales para el desarrollo de un proyecto musical.&nbsp; Podes solicitar un turno a traves de MiBA.&nbsp;Desde el 01 de junio hasta el 30 de noviembrePrograma gratuito | Atencion virtual
665	Produccion integral de podcast	https://disfrutemosba.buenosaires.gob.ar/lugares/produccion-integral-de-podcast	NULL	NULL	NULL	NULL	NULL	Estudio Urbano y el Festival BA Podcast, abren las inscripciones para la produccion integral de podcast. Un ciclo de formacion a distancia, gratuito, con vacantes limitadas, que abarcara, durante 6 modulos de cuatro clases cada uno, todas las etapas y aspectos de produccion de este formato de audio.La cursada tendra una duracion total de 3 meses, entre julio y septiembre y comenzara las inscripciones el martes 21 de junio, a traves del sitio web de Estudio Urbano. Cada modulo, dictado por reconocidos profesionales en el rubro, tendra cuatro encuentros virtuales semanales, y abarcara los siguientes temas:1. Produccion integral de podcast, por Yesica Bernardou y Marco Tonizzo.Martes, de 18 a 20 hs. Comienza el 5 de julio2. Preproduccion: guion y narrativa, por Joaquin StringaJueves, de 18 a 20 hs. Comienza el 7 de julio3. Aspectos legales y monetizacion, por Agustina Laboureau y Josefina Bonifacio.Martes, de 18 a 20 hs. Comienza el 2 de agosto 4. Arquitectura y diseno sonoro, por Marcos Serrao Gomez.Jueves, de 18 a 20 hs. Comienza el 4 de agosto 5. Podcast brandeados y estrategias de difusion, por Maria Laura Russo.Martes, de 18 a 20 hs. Comienza el 6 de septiembre 6. Distribucion multiplataforma y gestion tecnologica, por Gonzalo Soraiz.Jueves, de 18 a 20 hs. Comienza el 8 de septiembreInscripcion del 21 de junio a las 12h hasta el lunes 27 de junio a las 20h&nbsp;en https://www.buenosaires.gob.ar/estudiourbano o por correo a bapodcast@buenosaires.gob.ar. estara abierta para los primeros dos modulos. Los siguientes recibiran aplicaciones hasta unas semanas antes del comienzo de cada cursada. Las personas que resulten inscriptas seran contactadas para confirmar su participacion.-------------------------------------------------------------------------------------------------------------Estudio Urbano es un programa integral de capacitacion y formacion centrado en las industrias culturales, especialmente en la musica, que trabaja con las culturas juveniles con el objetivo de acercarles herramientas de conocimiento, a partir de su oferta anual de cursos y talleres y depende de la Direccion General de Musica, del Ministerio de Cultura del Gobierno de la Ciudad de Buenos Aires.Es un espacio de promocion de la actividad musical, que cuenta con un estudio de grabacion de acceso gratuito y recibio recientemente el apoyo de la UNESCO, para desarrollar politicas de formacion e inclusion con sectores vulnerables de la ciudad Para mas informacion sobre todas las actividades que realiza Estudio Urbano, buenosaires.gob.ar/estudiourbano.
669	Cultura Rap Federal	https://disfrutemosba.buenosaires.gob.ar/lugares/cultura-rap-federal	NULL	NULL	Espectaculos	NULL	NULL	Este ano Cultura Rap, el torneo de freestyle rap creado en El Recoleta para visibilizar a los nuevos talentos del rap local, se vuelve federal: 17 fechas, entre junio y noviembre, en distintas provincias del pais, hasta llegar a la gran final el 20 de noviembre en CABA. La competencia pasa a ser rango 2 en el ranking de FRF (Freestyle Rap Federation), otorgando al ganador de la final nacional 20.000 puntos para el ascenso a la FMS, la liga mas importante de freestyle del pais.En paralelo, desde junio comenzara el torneo anual tal como la conocemos, en la terraza del Recoleta. La competencia tendra formato de torneo y durara ocho fechas. Los mejores cinco competidores de la tabla obtendran el pase directo a la gran final nacional del 20 de noviembre, en el Teatro Vorterix.&nbsp;En la final se mediran todxs los competidores ya clasificados (catorce en total) quedando dos cupos libres para los y las freestylers que participen de la clasificatoria que sucedera de manera presencial el mismo dia de este gran evento.&nbsp;Esta competencia cuenta con el apoyo de UNICEF y el acompanamiento de Stromberg.Dom 26.06 | Fecha 1 Torneo de freestyle rap&nbsp; | 15 h | TerrazaDom. 31.07 | Fecha 3 Torneo de freestyle rap | 15 h | TerrazaDom 07.08 | Fecha 4 Torneo de freestyle rap&nbsp; | 15 h | TerrazaDom 28.08 | Fecha 5 Torneo de freestyle rap&nbsp; | 15 h | TerrazaDom. 11.09 | Fecha 6 Torneo de freestyle rap | 15 h | TerrazaCULTURA RAP EDICION SUB 18&nbsp;Una version para visibilizar a los talentos mas jovenes del rap local. Ademas, el Happy Hour de Escritura coordinado por Fer Blasco, tendra dos sesiones creativas grupales especialmente destinadas a adolescentes para jugar con las palabras, soltar la imaginacion y divertirse escribiendo. No es necesario tener experiencia, solo ganas de experimentar con la escritura.&nbsp;Jueves 21, 28 de julio | 14.30 h | Cultura Rap organizado por Juancin&nbsp;Se suspende por lluvia
