activity_id	activity_name	activity_url	activty_dates	activity_times	activty_place	activity_district	activity_address	activity_description
202	Festival Vegano	https://disfrutemosba.buenosaires.gob.ar/lugares/festival-vegano	NULL	NULL	NULL	NULL	NULL	Llega la septima edicion del Festival Vegano Sabe la Tierra. Mas de 40 emprendimientos de comida vegana, insumos para cocinar, cosmetica libre de crueldad animal, jugos energizantes naturales, diseno sustentable, plantas y plantines de huerta. Un evento para disfrutar de la gastronomia saludable en mesas comunitarias al aire libre. Ideal para visitar con toda la familia.Entre los productos 100 por ciento veganos ofrecidos habra&nbsp;jugos y bebidas naturales, gastronomia y pasteleria saludable y vegana, mermeladas artesanales hechas 100% de frutas y sin conservantes, cosmetica natural vegana, objetos de diseno con material recuperado, entre otros.Una cita imperdible para quienes llevan una vida en armonia con el planeta y los animales, y para quienes quieran conocer un poco mas sobre el mundo vegano o esten en una transicion alimentaria. Habra charlas sobre la transicion al veganismo, nutricionistas especializados en alimentacion vegana, clases de cocina para animarse a cocinar en base a plantas, charlas de huerta y compostaje,presentaciones de libros, charlas de astrologia, espacios de bienestar, djs en vivo, musica, humor y performers. Completan la propuesta de festival organizaciones de activismo y difusion, santuarios y refugios de animales.Se aceptan mascotas. Entrada libre y gratuita.Sabado 13 y el domingo 14 de agosto. | 11 a 19 h | Mercado de las Pulgas (Enrique Martinez y Concepcion Arenal)ACTIVIDADES CONFIRMADAS➔ Sabado 13 de agosto● 12h | Presentacion de El paraiso animal @elparaisoanimal● 13h | Viaje a los &amp;#39;90 @internet_garbitch● 15h | Filosofia y cuentos para infancias @poeticaantiespecista● 17h | Bailamos hasta el anochecer con @dj.vegan➔ Domingo 14 de agosto● 12h | Clase de Yoga @yoguifromtheblock● 13h | El impacto de nuestro plato con Lic. Flor Bogado, Lic Anto Testa @nutriflorbogado @tone.siendonutri● 14 h | Rumbas Flamencas Trio Mar de Rumbas @marderumbas● 15 h | Sin Tierra Hay Hambre Thomy Caffera @xrargentina● 16 h | Actividad a confirmar● 17 h | Disfrutamos de los mejores Hits Duo Vinilo @musicavinilo● 18 h | Cierre de festival Equipo Sabe La TierraENTRADA LIBRE Y GRATUITA
219	Buenos Aires Market	https://disfrutemosba.buenosaires.gob.ar/lugares/buenos-aires-market	NULL	NULL	NULL	NULL	NULL	Vuelve la feria “Buenos Aires Market” para perfumar Parque Centenario con aromas de los platos mas ricos para disfrutar en su Patio de Comidas. Ademas, en el Mercado de Productores tendras una enorme variedad de productos para tus compras de la semana.En el patio de comidas hay opciones para todos los paladares: paella, hamburguesas, rabas, tortillas, crepes, arepas, tequenos, shawarma, carnes braseadas, langostinos al ajillo, helados, licuados, cafe de especialidad, patisserie, picadas, cocina vegana y opciones sin tacc, entre otras propuestas. En el mercado, directo de los productores, podes encontrar quesos, embutidos, mermeladas, dulces regionales, infusiones, panificados, chocolates, hongos, conservas, mieles, especias, aderezos, productos de bazar y mucho mas.Sabado 6 y domingo 7 de agosto | 10 a 18hParque Centenario (Avenida Diaz Velez al 4800)Entrada gratuita+ info en instagram.com/bsasmarket
239	OTBA en Usina del Arte	https://disfrutemosba.buenosaires.gob.ar/lugares/otba-en-usina-del-arte	NULL	NULL	Museos y Galerias	NULL	NULL	El viernes 5 de agosto La Orquesta del Tango de Buenos Aires dara un nuevo concierto con un repertorio especial de clasicos del tango. Canta Lautaro Mazza y la conduccion estara a cargo de la periodista y locutora Mariana Fossati. Dirige a la Orquesta los Mtros. Nestor Marconi y. Juan Carlos Cuacci.Viernes 5 de agosto | 20hUsina del Arte | Agustin R Caffarena 1, Esq. Pedro de MendozaEntradas gratuitas | disponibles desde el 2 de agosto haciendo click aca--------------------------------------------La Orquesta del Tango de Buenos Aires nacio en 1980. Esta dirigida por los Maestros Nestor Marconi y Juan Carlos Cuacci. Premios: Disco de Oro por En vivo en el Colon (2001), Diploma al Merito Fundacion Konex como Conjunto de Tango (1995 y 2005). Nominaciones a los Grammy Latinos 2011 por sus trabajos 30 Anos. Nominaciones a los Grammy Latinos 2011 por sus trabajos 30 anos y Homenaje a Catulo Castillo y Anibal Troilo; Grammy Latino como Mejor album de tango 2015 y el Premio Carlos Gardel, como Mejor album de orquesta instrumental 2016, ambos reconocimientos por Homenaje a Astor Piazzolla, su ultimo trabajo editado.
271	Estacion Retiro	https://disfrutemosba.buenosaires.gob.ar/lugares/estacion-retiro	NULL	NULL	Transporte	Retiro	Av. Dr. Jose Maria Ramos Mejia 1430, C1104 CABA, Argentina	NULL
291	Torneo de Beatbox	https://disfrutemosba.buenosaires.gob.ar/lugares/torneo-de-beatbox	NULL	NULL	Espectaculos	NULL	NULL	¡Llega una nuva edicion del Duelo de parlantes! Un Torneo organizado por Beatbox Argentina. Los participantes mediran su talento en dos fechas imperdibles. El beatbox, cuya traduccion significa “caja de ritmos”, es una disciplina en la que se usa la boca y los labios para producir ritmos y sonidos musicales, generalmente de instrumentos de percusion como bateria, bombo, caja y platillos.&nbsp;El beatboxing permite crear un patron ritmico para rapear arriba sin necesidad de tener un reproductor musical. Su vinculacion con la cultura hip hop viene desde los anos 80, aunque la percusion vocal es un arte muy antiguo.Domingo 24 de julio&nbsp;| Duelo de parlantes 5° edicion | 15 h | Patio del AljibeDomingo 21 de agosto | Duelo de parlantes 6º edicion | 15 h | Patio del AljibeEntrada gratuita. Se reprograma por lluvia&nbsp;&nbsp;
299	Puerto Madero	https://disfrutemosba.buenosaires.gob.ar/lugares/puerto-madero	NULL	NULL	Parques y Plazas	Puerto Madero	Puerto Madero, CABA, Argentina	NULL
305	Av de Mayo	https://disfrutemosba.buenosaires.gob.ar/lugares/av-de-mayo	NULL	NULL	Parques y Plazas	Montserrat	Av. de Mayo & Bolivar, C1059 CABA, Argentina	NULL
315	Facultad de derecho	https://disfrutemosba.buenosaires.gob.ar/lugares/facultad-de-derecho	NULL	NULL	Espectaculos	Recoleta	Av. Pres. Figueroa Alcorta 2263, C1425CKB CABA, Argentina	NULL
322	Teatro Gran Rivadavia	https://disfrutemosba.buenosaires.gob.ar/lugares/teatro-gran-rivadavia	NULL	NULL	Teatros	Floresta	Av. Rivadavia 8636, C1407 CABA, Argentina	NULL
355	Cine mecenazgo	https://disfrutemosba.buenosaires.gob.ar/lugares/cine-mecenazgo-1	NULL	NULL	Espectaculos	NULL	NULL	Todos los miercoles llega Cine de Mecenazgo, para disfrutar de nuevas producciones cinematograficas. La entrada es libre y gratuita hasta agotar la capacidad de la sala.&nbsp;Una chica invisible | Francisco Bendomir, 2019Andrea descubre que un video vergonzoso de ella se ha vuelto viral. Mientras contempla la idea del suicidio, un hacker contratado por su ex novio la observa ansiosamente a traves de camaras ocultas instaladas en todo el apartamento de Andrea.Miercoles 3 | 19hEl ultimo traje | Pablo Solarz, 2017Narra el viaje de Abraham (Miguel Angel Sola), un sastre judio de 88 anos que decide embarcarse en la aventura de encontrar a un viejo amigo que le salvo hace mas de siete decadas de una muerte segura durante el holocausto, hacia el final de la ocupacion Nazi.Miercoles 10 | 19hQueer Diaries | Santiago Giralt, 2020Una mezcla de documental, diario intimo y autoficcion, Queer Diaries es un viaje sensorial y filosofico. A partir de una pelicula inconclusa, un director de cine vive, viaja y registra sus memorias como pequenos poemas y relatos audiovisuales en un manifiesto politico en defensa de lo queer. ¿Cuales son las formas de familia y de felicidad que construimos? ¿Que cine se debe hacer para este nuevo mundo?Miercoles 17 | 19hGualeguaychu, el pais del carnaval | Marco Berger, 2020Vilmar y Franco (el Toro) nacieron y viven en la ciudad de Gualeguaychu. Todos los veranos, desde su infancia, participan juntos de los carnavales populares de la ciudad. Esta fiesta magica logra maquillar, invadir de colores y plumas a los masculinos cuerpos de la comunidad. El alcohol, la camaraderia y el descontrol se vuelven protagonistas. Los limites de todo se desdibujan al calor del sol y al borde del imponente Rio Parana.Miercoles 24 | 19hLa estrella roja | Gabriel Lichtmann, 2021La investigacion acerca de una presunta espia internacional tras los nazis refugiados en Argentina da lugar a una trama que se expande, delira y se bifurca. Un falso documental que tiene en su centro a una elusiva mujer cuya estela puede rastrearse en las convulsiones mas enfaticas del siglo veinte.Miercoles 31 | 19hEntradas gratuitas hasta agotar capacidadEl Cultural San Martin | Sarmiento 1551
364	Espacio Iupiiiii	https://disfrutemosba.buenosaires.gob.ar/lugares/espacio-iupiiiii	NULL	NULL	Museos y Galerias	NULL	NULL	iiUpiiiii es el primer espacio cultural para la primera infancia de la Ciudad. Un espacio desarrollado por profesionales especializados en esta etapa infantil, que potencia y estimula la sensorialidad, la curiosidad, la sorpresa y el juego. Dirigido a ninos y ninas de 0-3 anos, presenta un universo seguro, con texturas y colores para disfrutar de las diferentes estaciones ludicas.La inscripcion y el ingreso es para un/a (1) nino/a acompanado/a de un (1) adulto. Las personas visitantes deberan ingresar sin calzado y es obligatorio el uso de cubreboca para los adultos. El turno tiene una duracion de 40 minutos. Solo se podra acceder al espacio a traves de previa inscripcion.De 11 a 17 h.Todas las entradas son gratuitas. La reserva de entradas se habilitara a las 10 am, en esta misma pagina, 72 horas antes del evento.Entradas con reservas en esta pagina.&nbsp;
394	Cine Cosmos	https://disfrutemosba.buenosaires.gob.ar/lugares/cine-cosmos	NULL	NULL	Centros culturales	Villa General Mitre	Av. Corrientes 2046, C1045AAP CABA, Argentina	NULL
404	Ciclo de Musica Clasica	https://disfrutemosba.buenosaires.gob.ar/lugares/ciclo-de-musica-clasica	NULL	NULL	NULL	NULL	NULL	La Banda Sinfonica de la Ciudad de Buenos Aires continua con sus presentaciones e invita al concierto que dara lugar en la Legislatura Portena dirigido por el Mtro. Carlos David Jaimes. Sera un concierto con un amplio repertorio especial de clasicos.Programa:Obertura de concierto N°1: Alberto WilliamsObertura de concierto N°2: Alberto WilliamsMi vina de Chapanay: Carlos GuastavinoVerano porteno: Astor PiazzollaEl Firulete, Grisel y Taquito Militar:&nbsp;Mariano MoresArreglos: Martin DarreViernes 12 de agosto | 18h&nbsp;Salon Dorado Legislatura Portena | Peru 160Entrada gratuita------------------------------------------------------------------------------------------------------------------------------------------------Carlos David Jaimes. Realizo sus estudios de musica en la Universidad Nacional de las Artes. Se formo en direccion orquestal con Mario Benzecry y Carlos Calleja y se perfecciono en la Fundacion Teatro Colon y el Mozarteum Argentino. Fue director adjunto de la Orquesta Academica del Teatro Colon y dirigio operas, operetas y titulos del repertorio coreografico junto al Ballet Nacional. Fue director musical del Ballet Contemporaneo del Teatro San Martin. Dirigio como invitado las orquestas Academica del Teatro Colon, Filarmonica de Mendoza, Sinfonica de Santa Fe, Sinfonica de Bahia Blanca, Nacional de Musica Argentina Juan de Dios Filiberto, Sinfonica Municipal de Avellaneda, Sinfonica de la Universidad Nacional de Tucuman, Nacional Juvenil de Chile, entre otras; director adjunto de la Orquesta Academica de Buenos Aires desde su creacion hasta 2018 y director asistente de la Orquesta Sinfonica Municipal de Florencio Varela.La Banda Sinfonica de la Ciudad de Buenos Aires. Organismo estable de la Direccion General de Musica, fue creada por iniciativa del director Antonio Malvagni, para darle a la ciudad una agrupacion sinfonica de caracter permanente. Se presento oficialmente en el Teatro Colon el 14 de Mayo de 1910 para celebrar el Centenario de la Revolucion de Mayo. Fue dirigida por figuras de trayectoria nacional e internacional como Rafael Del Giudice, Domingo Calabro, Reinaldo Zamboni, Mariano Drago, Gerardo Gandini, Roberto Farias (Brasil), Dennis Johnson (Estados Unidos), Vito Clemente (Italia), Jose Maria Castro, Pascual Grisolia, Mario De Rose, Bernardo Teruggi, Gustavo Fontana y Jose Luis Cladera, Mario Perusso y Lito Valle. A ellos se sumaron Juan Jose Castro, Luis Gianneo, Pedro Ignacio Calderon y Simon Blech, entre otros. Sus actuales directores son Dario Dominguez Xodo y Carlos David Jaimes. Desde sus inicios, la Banda Sinfonica de la Ciudad realiza una constante tarea de divulgacion tanto en espacios abiertos, plazas y parques como en salas de conciertos y escuelas publicas portenas, donde desarrolla una intensa labor pedagogica mediante su ciclo anual de conciertos didacticos. En el ano de su 110° aniversario tiene muchas novedades y festejos, en breve presentara un libro con detalles de extensa trayectoria e imagenes historicas ineditas; tambien tiene programado una presentacion mensual en la sala de la Usina del Arte, donde alternaran conciertos didacticos para alumnos de escuelas portenas y conciertos especiales.
417	Parque de la Estacion	https://disfrutemosba.buenosaires.gob.ar/lugares/parque-de-la-estacion	NULL	NULL	Parques y Plazas	Almagro	Tte. Gral. Juan Domingo Peron 3326, B1613AUT CABA, Argentina	NULL
427	Feria de Mataderos	https://disfrutemosba.buenosaires.gob.ar/lugares/feria-de-mataderos	NULL	NULL	NULL	NULL	NULL	En la Feria de Mataderos podes comprar piezas artesanales unicas realizadas por artesanos y artesanas de distintas partes de nuestro pais. Desayunar, almorzar o merendar con amigos o familia y disfrutar de comidas y dulces regionales. Aprender telar, danzas folkloricas, guitarra, lengua quichua, sikus. Participar de sus talleres gratuitos y libres para todas las edades.Todos los domingos | De 11 a 18 hAv. Lisandro de la Torre y Av. de los Corrales | MataderosEntrada libre y gratuita. Se suspende por lluvia.#Cuidarteescuidarnos------------------------------------------------------------------------------------------------------------------------------------------------Sobre la FeriaFue creada en 1986 con el objetivo de generar un espacio permanente para la produccion y difusion de nuestras raices culturales a traves de las artesanias, la musica, los platos tipicos y todas las costumbres de nuestro folclore nacional. Es asi que durante todos estos anos, vecinos y vecinas de la Ciudad pudieron acercarse a su inmenso predio al aire libre para degustar lo mejor de nuestra gastronomia, ver en vivo a artistas folcloricos locales y regionales, y adquirir piezas realizadas por productores artesanales de todo el pais.La Feria, una de las mas grandes de la Ciudad, se convirtio en un verdadero espacio de encuentro, hecho a medida de los historicos mercados populares, donde se valoriza tanto la calidad como la autenticidad de los productos expuestos y ofreciendo espectaculos de musica y baile realizados por profesionales de nuestro folclore.
435	La Rural	https://disfrutemosba.buenosaires.gob.ar/lugares/la-rural	NULL	NULL	Centros culturales	Palermo	Av. Sarmiento 2704, Buenos Aires, Argentina	NULL
458	Espacio Cultural Julian Centeya	https://disfrutemosba.buenosaires.gob.ar/lugares/espacio-cultural-julian-centeya	NULL	NULL	Centros culturales	San Cristobal	Av. San Juan 3255, C1233ABC CABA, Argentina	NULL
472	Biblioteca del Teatro Colon	https://disfrutemosba.buenosaires.gob.ar/lugares/biblioteca-del-teatro-colon	NULL	NULL	Teatros	NULL	NULL	La Biblioteca del Teatro Colon cuenta con un vasto material de archivo, integrado por programas de mano que datan desde 1908 a la actualidad, libros, recortes, diarios musicales, partituras, entre muchos documentos mas, ademas de que se encuentra en permanente incorporacion y restauracion de los mismos. En este momento, el espacio cuenta con aproximadamente entre cinco mil y siete mil ejemplares y prevee aumentar su cantidad.Desde hace unos anos, la sala cuenta con terminales de autoconsulta sobre los programas de mano digitalizados, donde los asistentes podran informarse dentro de la intranet del Centro de Documentacion. La biblioteca, ademas, cuenta con un escaner que permitira reproducir sin cargo y a quien lo necesite, hasta dos hojas por libro.Ya se encuentran a disposicion para su consulta los recortes de prensa (encuadernados)&nbsp; desde el ano 1928, que se van incorporando a la coleccion existente en biblioteca.De lunes a viernes de 10 a 17 h con turno previo. Pedi tu turno en&nbsp;bibliotecaeatc@buenosaires.gob.ar | Para mas informacion comunicarse al&nbsp; 4378-7137&nbsp; o&nbsp; 4378-7198Teatro Colon | Tucuman 1171 | (Pasaje de los Carruajes)Entrada gratuita#Cuidarteescuidarnos
485	Biblioteca Evaristo Carriego	https://disfrutemosba.buenosaires.gob.ar/lugares/biblioteca-evaristo-carriego	NULL	NULL	Bibliotecas	Palermo	Honduras 3784, C1180 ACB, Buenos Aires, Argentina	NULL
487	Casa de la lectura	https://disfrutemosba.buenosaires.gob.ar/lugares/casa-de-la-lectura	NULL	NULL	Bibliotecas	Villa Crespo	Lavalleja 924, C1414DTT CABA, Argentina	NULL
500	Espacio Cultural Carlos Gardel	https://disfrutemosba.buenosaires.gob.ar/lugares/espacio-cultural-carlos-gardel	NULL	NULL	Centros culturales	Colegiales	Olleros 3640, C1427EGP CABA, Argentina	NULL
516	Convocatoria TANGO BA	https://disfrutemosba.buenosaires.gob.ar/lugares/convocatoria-tango-ba	NULL	NULL	NULL	NULL	NULL	Se abre la inscripcion para participar en la edicion 2022 de Tango BA Mundial de Baile. Podran inscribirse bailarines amateurs y profesionales, mayores de 18 anos, en la categoria Tango de Pista y/o Tango Escenario, desde el martes 2 hasta el miercoles 31 de agosto en el siguiente link: https://www.buenosaires.gob.ar/cultura/festivales-de-buenos-aires/mundial-de-baile-tango-baEste ano, el Tango BA Festival y Mundial que reune a tangueros de todo el mundo con referentes y fanaticos del genero, se desarrollara entre el 6 y el 18 de septiembre. Luego de la inscripcion on line, los bailarines deberan acreditarse personalmente, los dias 6, 7 y 8 de septiembre en el horario de 10 a 18 horas en la Usina del Arte. Consultas en:&nbsp;competencia@festivales.gob.arLas rondas clasificatorias de&nbsp;Tango de Pista&nbsp;se realizaran los dias 9 y 10 de septiembre de 2022 en la Usina del Arte.&nbsp;Cada pareja bailara dos veces,&nbsp;en&nbsp;una ronda de tres tangos. Sera evaluada por 10 jurados. La Semifinal sera el 14 de septiembre de 2022, en la Usina del Arte y cada pareja bailara una sola vez, sera evaluada por 6 jurados.Las rondas clasificatorias de&nbsp;Tango Escenario&nbsp;se realizaran los dias 11 y 12 de septiembre de 2022 en la Usina del Arte.&nbsp;Cada pareja bailara dos veces. Sera evaluada por 10 jurados.&nbsp;La&nbsp;Semifinal sera el 15 de septiembre de 2022 en la Usina del Arte. Cada pareja bailara una sola vez, sera evaluada por 6 jurados.Las Finales de ambas categorias se llevaran a cabo el 17 de septiembre de 2022. Cada pareja bailara una sola vez, sera evaluada por 7 jurados.
520	Smart Plaza	https://disfrutemosba.buenosaires.gob.ar/lugares/smart-plaza	{'Lunes', 'Martes', 'Domingo', 'Sabado', 'Jueves', 'Viernes', 'Miercoles'}	{'11:00 a 01:00', '11:00 a 00:00'}	Gastronomia	Parque Patricios	Pepiri 185, C1437 EIC, Buenos Aires, Argentina	Smart Plaza Patio Parque Patricios, la primera plaza inteligente de America Latina, se renovo y suma una experiencia tecnologica con aplicacion propia. Cuenta con seis puestos con oferta gastronomica de hamburguesas, pizzas, comida natural, pescados, helado, pasteleria y cafeteria ademas de dos cervecerias, todo para disfrutar al aire libre. Los diferentes menus pueden verse y pedirse desde la aplicacion Smart Plaza para evitar largas filas, pagar de forma electronica y poder ubicarse en una de las 50 mesas con bancos de madera a disposicion.Lunes a Jueves | 11 a 00 hViernes y sabados | 11 a 1 hDomingo | 11 a 00 hPepiri 185 (esquina Uspallata)Entrada libre y gratuita
530	Agosto en el Cultural Carlos Gardel	https://disfrutemosba.buenosaires.gob.ar/lugares/agosto-en-el-cultural-carlos-gardel	NULL	NULL	Centros culturales	NULL	NULL	Este agosto, en el Centro Cultural Carlos Gardel, empieza con las siguientes actividades:IndomitaA partir de un juego se produce un encuentro de cuatro mujeres que hicieron historia: Marilyn Monroe, Juana Azurduy, Marie Curie y Simone de Beauvoir. A traves de cartas originales escritas por ellas: una guerrera, una filosofa, una actriz y una cientifica, cada una nos acerca a sus ideas, convicciones, amores, angustias, contradicciones y pasiones.5 de agosto | 20:30h&nbsp;“Cumbia Morena Cumbia”, Mauricio KartunEntre las ruinas de un viejo club abandonado, Wily y Rulo esperan a las rubias de sus suenos. Se debaten entre el escepticismo y la ilusion, entre la euforia y la depresion. Al modo de los personajes beckettianos estos Vladimir y Estragon vernaculos expresan la desolacion, la negacion de la realidad y del paso del tiempo utilizando como unico recurso la construccion de una historia conmovedora por lo ilusoria y fantastica. Como siempre la lucha entre la fantasia y lo real, entre las circunstancias que corroen y las esperanzas que nos invitan a seguir.&nbsp;6 de agosto | 20:30hTodos Vivos2 de abril de 1982. Luis, un muchacho de 18 anos, es convocado a la guerra de Malvinas. La idea de ir al combate lo paraliza y el terror le hace perder la razon. Desde entonces es un excombatiente que vive a la intemperie del sentido, un veterano que camina en el limite entre la realidad y la ficcion de nuestra propia historia.12 de agosto | 20:30hLa Magia es cosa seriaUn espectaculo de magia, clown, circo y comedia fisica creado por Capotina, donde Kikina y Allegro transitan situaciones disparatadas siendo el hilo conductor la magia.13 de agosto | 16hEl Karaoke del Buen SufrirLa Conga del Buen Sufrir te invita a El Karaoke del Buen Sufrir, una posibilidad unica de subirte al escenario a cantar con una banda en vivo y divertirte con monologos y escenas de humor.13 de agosto | 20hTenues e Intensos, Lila KB&nbsp;&nbsp;Una muestra basada en series desarrolladas durante los particulares anos 2020 y 2021. Estos cuadros buscan reflejar la interaccion compleja entre mi mundo interior y exterior, unidos por una energia vital que irrumpe y se arremolina. La estructura nace del gesto automatico. En algun momento, las imagenes se diluyen, se conectan con un recuerdo intenso y definen la conexion personal con esa imagen. El espectador completara la obra.Inauguracion 2 de agosto | 19h2 al 14 de agosto | 11 a 20hArtistas por PalestinaSeleccion de obras pertenecientes a la coleccion del III Salon Latinoamericano y VI Nacional de Grabado Palestina Libre. Esta exposicion resalta el compromiso de artistas por la defensa de los derechos humanos del pueblo palestino. Desde distintos ambitos de la cultura Argentina y de otros paises de America Latina, las artes plasticas y otros modos de expresion se han constituido en medios esenciales para difundir la realidad palestina y concientizar sobre lo que padece. “Artistas por Palestina” es una puerta, una ventana, una llave fundamental para ver, escuchar y sentir parte de la realidad del pueblo palestino.16 al 28 de agosto | 11 a 20hEspacio Cultural Carlos Gardel | Olleros 3640Entrada libre y gratuita
