activity_id	activity_name	activity_url	activty_dates	activity_times	activty_place	activity_district	activity_address	activity_description
685	4° edicion del Premio AZCUY	https://disfrutemosba.buenosaires.gob.ar/lugares/4-edicion-del-premio-azcuy	NULL	NULL	NULL	NULL	NULL	Por cuarto ano consecutivo, abre la convocatoria para una nueva edicion del Premio Azcuy, en alianza con el Museo de Arte Moderno de Buenos Aires y de la mano de la recientemente creada FUNDACION AZCUY.&nbsp;Se trata de un concurso de alcance nacional dirigido a artistas individuales o colectivos argentinos (o con residencia en el pais desde hace mas de tres anos). Su mision es reconocer, difundir y fomentar la produccion artistica local, estimulando la puesta en valor del arte nacional.&nbsp;Es una oportunidad unica para que artistas de todo el pais imaginen proyectos que pueden llevar su practica a nuevos escenarios y escalas. La iniciativa tiene el objetivo de que la cultura forme parte de nuestra cotidianeidad, salga de los espacios tradicionales y se instale en lugares no convencionales.&nbsp;Desde el 1 de julio al 31 de agosto los artistas podran anotarse para participar con sus proyectos. Al cierre de la convocatoria, un jurado de expertos integrado por artistas, curadores, representantes del Museo Moderno y de Azcuy seleccionara 5 finalistas a quienes se les otorgara un premio estimulo de $200.000 pesos para desarrollar sus propuestas con mayor profundidad y volver a presentarlas al jurado. De esta presentacion surgira la obra ganadora que se dara a conocer en noviembre. El artista recibira un premio de $2.000.000 pesos y la produccion de su obra, que se pondra en marcha apenas concluido el certamen bajo su direccion y supervision, sera enteramente costeada por Azcuy.&nbsp;Inscripcion&nbsp;mediante&nbsp;la web www.premioazcuy.com, donde encontraran las bases y condiciones, y accederan a toda la documentacion necesaria para iniciar el proceso de inscripcion. Desde 01 de julio hasta el 31 de agosto inclusive---------------------------------------------------------------------------------------------------------------------------AZCUY es una compania creativa de real estate con mas de treinta anos de trayectoria en la Argentina dedicada a desarrollar, disenar, construir y comercializar arquitectura residencial en el barrio de Caballito de la Ciudad de Buenos Aires. Su trabajo busca lograr la mejor ecuacion entre diseno y sustentabilidad, por lo que se orienta a favorecer el vinculo entre las personas y la naturaleza, a cuidar el medio ambiente a partir del uso responsable de la energia en sus edificios y a generar un impacto social y cultural positivo en la comunidad. Comprometidos con el uso responsable de los recursos, el cuidado de los detalles y atentos a las posibilidades que ofrece la mas alta tecnologia y el conocimiento exhaustivo de los materiales, los proyectos de AZCUY buscan crear espacios de calidad que aseguren una experiencia de bienestar a lo largo del tiempo. AZCUY fue fundada y es dirigida por el arquitecto Gerardo Azcuy, cuyo compromiso con la creacion del mejor entorno posible para el desarrollo de nuestra vida cotidiana lo alento a iniciar el Premio Azcuy, por el cual se seleccionan proyectos artisticos de calidad para que pasen a formar parte integral y patrimonial de los edificios que la compania desarrolla.El Museo de Arte Moderno de Buenos Aires, institucion publica dependiente del Ministerio de Cultura del Gobierno de la Ciudad de Buenos Aires, fue creado en abril de 1956 por iniciativa de Rafael Squirru, su primer director. Desde sus inicios, el Moderno fue un museo de vanguardia, verdadera casa de los artistas argentinos, y un espacio dedicado a promover las ultimas producciones de todas las disciplinas artisticas. Ubicado en el barrio de San Telmo, el Museo Moderno exhibe su coleccion de arte moderno y contemporaneo, produce exhibiciones temporarias de artistas nacionales y extranjeros, ya sean individuales o grupales, y genera un fuerte vinculo con la comunidad a traves de un intenso programa de actividades educativas y culturales destinadas a los mas diversos publicos.La Fundacion Azcuy busca construir una sociedad mejor, llevando adelante pequenas y grandes acciones. El objetivo es contribuir al bienestar de la sociedad a traves de la arquitectura, el arte, el urbanismo, la responsabilidad social
707	Red de Bienestar	https://disfrutemosba.buenosaires.gob.ar/lugares/red-de-bienestar	NULL	NULL	NULL	NULL	NULL	Por si no sabias, la Ciudad, en la mayoria de sus comunas, cuenta con distintos puntos de bienestar&nbsp;llenos de actividades recreativas, cognitivas, artisticas y culturales con el objetivo de mejorar el bienestar de cada uno de nosotros. Veni y animate a conocer alguna de estas propuestas:&nbsp;ESTACIONES SALUDABLESUn espacio para potenciar nuestro bienestar. Ademas de fomentar una alimentacion sana, la actividad fisica y el control periodico de la salud, se proponen actividades de esparcimiento y recreacion.Lunes a viernes: Asesoria nutricional y enfermeria: Control de presion arterial, talla y peso. | Sabados y domingos: Actividad fisica y taller cognitivo. | Horarios y ubicacion en el siguiente linkLA TERCERA EN LA CALLESe impulsan actividades fisicas, recreativas, cognitivas, artisticas y culturales en plazas y parques de la Ciudad, para promover el envejecimiento activo y saludable.Lunes a viernes de 09 a 11:30hs y de 12:30 a 15hs | Ubicaciones en el siguiente linkCENTROS DE DIA (CDD)Son espacios pensados para las personas mayores, donde se realizan actividades reflexivas, recreativas, culturales, corporales y cognitivas. En los CDD se ofrecen servicios de orientacion psicologica, social y juridica; en pos de promover su independencia y autonomia y contribuir a la mejora de su calidad de vida.Lunes a viernes de&nbsp;09 a16hs | Sabados de 09 a 15hs| Ubicaciones en el siguiente linkEntrada libre y gratuitaBA Bienestar &nbsp; &nbsp; &nbsp; &nbsp; &nbsp; &nbsp; &nbsp; &nbsp; &nbsp; &nbsp; &nbsp; &nbsp; &nbsp; &nbsp; &nbsp; &nbsp; &nbsp; &nbsp;Ciudad Amigable&nbsp;IG: @BABienestar &nbsp; &nbsp; &nbsp; &nbsp; &nbsp; &nbsp; &nbsp; &nbsp; &nbsp; &nbsp; &nbsp; &nbsp; &nbsp; &nbsp; &nbsp;IG: @BACiudadAmigableFB: /BienestarGCBA&nbsp; &nbsp; &nbsp; &nbsp; &nbsp; &nbsp; &nbsp; &nbsp; &nbsp; &nbsp; &nbsp; &nbsp; &nbsp; FB: /CiudadAmigableGCBATW:@BA_Bienestar&nbsp; &nbsp; &nbsp; &nbsp; &nbsp; &nbsp; &nbsp; &nbsp; &nbsp; &nbsp; &nbsp; &nbsp; &nbsp; &nbsp;TW: @BA_Amigable
723	Wild Bass Festival	https://disfrutemosba.buenosaires.gob.ar/lugares/wild-bass-festival	NULL	NULL	Parques y Plazas	NULL	NULL	Llega Wild Bass Festival, un ciclo de musica under electronica del estilo Bass Music con 6 DJ`s Sets en escena que haran sets de 30 minutos cada uno. El festival apunta a dar a conocer a los artistas emergentes del estilo Bass. Cada Dj que se presenta tiene su propio estilo Bass. Cabe destacar que es un estilo muy reconocido y con cada vez mayor audiencia a nivel nacional e internacional. Un espectaculo para todo publico en el Anfiteatro de Parque Centenario, gratis, por orden de llegada, hasta completar la capacidad.DJ´s participantes: XLAB / AXS / KR4D / HOLO ICE / TOMMLOW / LEON ELLUS / JOHN DARTEViernes 12 de agosto | 16:30hAnfiteatro de Parque Centenario | Av. Lillo y Leopoldo MarechalEntrada gratuita por orden de llegada hasta agotar la capacidad Se suspende por lluvia
759	Inclusion digital	https://disfrutemosba.buenosaires.gob.ar/lugares/inclusion-digital	NULL	NULL	NULL	NULL	NULL	Conoce los talleres que La Ciudad tiene para ofrecer desde el programa de Inclusion Digital. Esta propuesta trabaja en la inclusion digital de las personas mayores mediante encuentros virtuales y presenciales de capacitacion y practica en el uso de tecnologia digital en la vida diaria, buscando promover la alfabetizacion digital y el fortalecimiento del uso de herramientas tecnologicas y dispositivos moviles. Las actividades y capacitaciones estan destinadas a personas mayores de 60 anos.Los talleres que propone el programa de Inclusion Digital son:Aprende a usar:El programa capacita a las personas mayores sobre el uso de herramientas digitales tales como mensajeria movil, Email, Apps de Delivery, Redes Sociales, Educacion Financiera y Boti + Simple.&nbsp; Ademas, se realizan capacitaciones presenciales en diversos espacios (clubes, cesacs, centros de jubilados, otros) teniendo capilaridad en todas las Comunas de la Ciudad.Las capacitaciones se dictan en modalidad virtual. Inscripcion por formulario en las redes sociales de la Secretaria los martes a las 14 horas.Finanzas digitales:Junto a Desarrollo Economico y al Banco Ciudad realizamos capacitaciones sobre educacion financiera: uso de billetera virtual, seguridad, y otras herramientas para el manejo digital de las finanzas.Las capacitaciones se dictan en modalidad virtual. Inscripcion por formulario en las redes sociales de la Secretaria los viernes a las 14 horas.Prevencion Ciberdelito:Taller de encuentros sobre prevencion de delitos informaticos y sobre como navegar por Internet con seguridad; como proteger datos personales, como detectar estafas virtuales, entre otros temas.Desayunos Digitales:Desarrollamos encuentros mensuales con personas mayores, bajo la modalidad de conversatorios virtuales, en los que se comparten las propuestas de la Secretaria para este segmento y se trabaja en el desarrollo de nuevas iniciativas. En estos desayunos se conversa sobre los gustos y preferencias de las personas mayores, para brindar propuestas especialmente adaptadas y facilitar el vinculo de los vecinos mayores con la Ciudad de Buenos Aires.Las capacitaciones se dictan en modalidad virtual. Inscripcion por formulario en las redes sociales de la Secretaria con frecuencia mensual.Boti +SimpleBuscamos que las personas mayores puedan conocer de manera simple las diferentes actividades recreativas, cursos y talleres e informacion util para vivir la Ciudad. Tambien brindamos asistencia digital para tramites.Para acceder a esta informacion, podes comunicarte con Boti a traves de Whatsapp al numero 11-5050-0147 y escribir “Personas Mayores”.--------------------------------------------------------------------------------------------------------------------------------Para mas informacion podes comunicarte a traves de:Telefono: 5030-9740 (interno 1640)Instagram: @BACiudadAmigableFacebook: www.facebook.com/BACiudadAmigable o como Ciudad Amigable GCBATwitter: @BA_AmigableMail: bienestarintegral@buenosaires.gob.ar
761	Participa del Festival Buenos Aires Jazz	https://disfrutemosba.buenosaires.gob.ar/lugares/participa-del-festival-buenos-aires-jazz	NULL	NULL	NULL	NULL	NULL	Hasta el 31 de agosto grupos y solistas de todo el pais podran anotarse para formar parte de la edicion 2022 del Festival de Jazz de la ciudad de Buenos Aires. Son dos las convocatorias activas: Nuevos Discos y Grupos o Proyectos Solistas de jazz. Los seleccionados en ambas categorias formaran parte de la edicion 2022 del festival.&nbsp;En la convocatoria Nuevos Discos podran inscribirse quienes hayan editado nuevo material entre el 1 de octubre de 2021 y el 1 de noviembre de 2022. Entre los postulantes se seleccionaran cuatro proyectos que participaran de Buenos Aires Jazz 2022.En la convocatoria Grupos o Proyectos Solistas podran participar musicos y grupos en las categorias Jazz Standards/Straight Ahead/Mainstream, Free Jazz/Contemporaneo/Experimental, y Fusion. De ella se seleccionaran un maximo de ocho proyectos que formaran parte de la programacion del festival.Ambas convocatorias tienen como fin darle la posibilidad a artistas de todo el pais de formar parte y mostrar su trabajo en el Festival Internacional de Jazz de la ciudad de Buenos Aires. El jurado encargado de seleccionar los proyectos ganadores estara integrado por figuras de reconocida trayectoria dentro del ambito artistico y sociocultural.La inscripcion estara abierta hasta el miercoles 31 de agosto en la&nbsp;web del festival.
768	Feria Argentina del Alfajor	https://disfrutemosba.buenosaires.gob.ar/lugares/feria-argentina-del-alfajor	NULL	NULL	NULL	NULL	NULL	Llega la 1° edicion de la Feria Argentina del Alfajor. Por primera vez en Argentina todo el sector Alfajorero expone sus productos y sus mas exquisitas creaciones. Durante los dias de la Feria podras conocer a los productores de alfajores de todo el Pais. Tambien en el mismo salon se realizara en conjunto la eleccion del mejor alfajor del mundo en el marco del Campeonato Mundial del Alfajor, el jueves 4 y viernes 5, de 10h a 18h . Un Jurado especializado realizara una cata a ciegas de cientos de muestras de 15 categorias diferentes. Se entregaran mas de 45 premios y medallas.Entrada gratuita a traves de Eventbrite | cupos limitadosLunes 1 hasta el viernes 5 de agosto | 10 a 18hPrimer piso Galeria Central | Av. Corrientes y Florida
771	La Trochita: 100 anos de historia	https://disfrutemosba.buenosaires.gob.ar/lugares/la-trochita-100-anos-de-historia	NULL	NULL	NULL	NULL	NULL	A partir del lunes 25 de julio, hasta el 12 de agosto, se podra visitar la muestra fotografica La Trochita: 100 anos de historia. Luego, el martes 2 de agosto a las 14:30h, se realizara una jornada cultural que incluye la presentacion del libro: La Trochita, Viejo Expreso Patagonico&nbsp;y una recorrida por la muestra fotografica.La muestra se encuentra integrada por imagenes de la centenaria formacion ferroviaria, que recorre parte de nuestra Patagonia sobre sus vias de trocha angosta. Su historia se remonta a principios del siglo XX, cuando se impulso la sancion de la Ley 5559 de Fomento de los Territorios Nacionales, con el objetivo de promover el desarrollo de La Patagonia, y sumarse a una estrategia de integracion ferroviaria de las areas potencialmente productivas. En 1921 se decidio conectar este pueblo con Esquel y para el ano 1922 se decidio comprar 50 locomotoras Henschel en Alemania y otras 25 Baldwin en Estados Unidos, mientras que los vagones fueron fabricados en Belgica. El 7 de octubre de 1922 se autorizo el trazado en trocha economica de 75 cm, del ferrocarril que llega hasta Esquel, a traves de 402 kilometros y mas de 600 curvas. Martes 2 de agosto | 14:3025 de julio hasta 12 de agosto | Dias habiles |&nbsp; 08 a 20hsCamara de Diputados de la Nacion | Av. Rivadavia 1841 | Planta Baja del Anexo A 
794	Mes de la cultura independiente	https://disfrutemosba.buenosaires.gob.ar/lugares/mes-de-la-cultura-independiente	NULL	NULL	Centros culturales	NULL	NULL	Detras de cada lugar, hay una historia. Voces, ideas y miradas que dan forma a una cultura viva, en ebullicion. Por eso, queremos mostrar las historias del mundo independiente: dar a conocer como surgieron y crecieron estos espacios fuera del circuito mas visible y desde una logica tan diferente como enriquecedora. 6 voces dan a conocer las propuestas que hicieron crecer a partir de un sueno y mucho esfuerzo.&nbsp;Ademas, los espacios culturales independientes distribuidos por toda la ciudad formaran parte de esta programacion con espectaculos en cada uno.---------------------LA MINGA, Un club cultural con identidad de barrioMaza 1165IG: @LAMINGACC--------------------ROSETI,&nbsp;un punto de encuentro con lenguajes hibridosGallo 760IG: @ROSETIESPACIO-----------------------LUZURIAGA, un club social, con gerenciamiento familiarLuzuriaga 348IG: @luzuriagaclubsocial-----------------------CASA BRANDON, ??Luis Maria Drago 236IG: ?----------------------QUETREN QUETREN, salir a la cancha y diversificar la escenaAv. Olazabal 1784IG: ?--------------------------LA CASA DEL ARBOL,&nbsp;una aventura culturalAv. Cordoba 5217IG: _@lacasadelarbol_
795	La obra de J. L. Borges	https://disfrutemosba.buenosaires.gob.ar/lugares/la-obra-de-j-l-borges	NULL	NULL	Museos y Galerias	NULL	NULL	A partir del martes 16 de agosto, iniciara el Taller de lectura sobre la obra de J. L. Borges, que se recorrera a traves de el Borges realista, el Borges fantastico y el Borges intertextual, a cargo del Lic. Pablo Gaiano.El taller brinda las claves centrales de las muy variadas tecnicas literarias y filosoficas utilizadas por Borges para escribir sus cuentos. Se abordan todos los generos trabajados por el autor, desde sus cuentos realistas hasta sus cuentos fantasticos.Inscripciones:&nbsp;literaturaciudad@yahoo.com.arMartes | 16:30 a 18hPresencial | trimestralMuseo de Arte Hispanoamericano Isaac Fernandez BlancoSede Palacio Noel | Suipacha 1422, Barrio Retiro
797	Hacia los 40 anos de vida en democracia	https://disfrutemosba.buenosaires.gob.ar/lugares/hacia-los-40-anos-de-vida-en-democracia	NULL	NULL	Espectaculos	NULL	NULL	"El Cultural San Martin recibe a Beatriz Sarlo y Diana Maffia en el primer encuentro de Hacia los 40 anos de vida en democracia, un nuevo ciclo con el proposito de construir un espacio para el dialogo y de reafirmar el contrato democratico. De este modo, se desarrollaran encuentros mensuales que reunan a diversos actores sociales en donde puedan abordar distintos ejes para, a partir de lo transitado, proyectar hacia el futuro. Para este primer encuentro entonces, denominado ""Los derechos politicos, la participacion ciudadana y la cultura democratica"", la ensayista y critica literaria, Beatriz Sarlo, y la filosofa especializada en genero y diversidad, Diana Maffia, se reunen a conversar con el publico tanto de lo conquistado como de lo que aun queda por conquistar en materia de derechos humanos y participacion ciudadana.Martes 9 de agosto | 19hEl Cultural San Martin | Sarmiento 1551Entrada libre y gratuita |&nbsp;Sala Muino"
799	Bolero + Fervor	https://disfrutemosba.buenosaires.gob.ar/lugares/bolero-fervor	NULL	NULL	Teatros	NULL	NULL	Dos coreografas, dos obras: por un lado, uno de los clasicos del repertorio del Ballet Contemporaneo; por el otro, un exponente de los nuevos abordajes de la danza. Ambas trabajan la fusion de distintos lenguajes de movimiento; Bolero en torno al tema de la repeticion, Fervor en relacion a la energia desbordante, a la danza como “acto de ardor”.&nbsp;BoleroCoreografia y direccion: Ana Maria StekelmanMusica original: Maurice Ravel BoleroReposicion coreografica: Elisabeth Rodriguez y Melisa BuchelliVestuario: Renata SchussheimDiseno de iluminacion: Alberto LemmeDuracion: 20 minutosFervor: hacer de la danza un acto de ardor.Coreografia y direccion: Josefina GorostizaReposicion coreografica: Elisabeth Rodriguez y Melisa BuchelliDiseno de musica original y diseno sonoro en escena: Kchi Homeless (Facundo Montoya)Diseno de iluminacion: Claudio Del BiancoDuracion: 25 minutosBailarines: Constanza Aguero, Brenda Arana, Lucia Bargados, Carolina Capriati, Flavia Dilorenzo, Fiorella Federico, Paula Ferraris, Daniela Lopez, Silvina Perez, Eliana Picallo, Andrea Pollini, Eva Prediger, Lara Rodriguez, Ivana Santaella, Manuela Suarez Poch y Antonella Zanutto. Adriel Ballatore, Dario Calabi, Juan Camargo, Matias Coria, Matias De Cruz, Francisco De Assis, Lautaro Dolz, Rodrigo Etelechea, Darcio Goncales, Alejo Herrera, Jonas Grassi, David Millan, Andres Ortiz, Boris Pereyra, Emiliano Pi Alvarez, Ruben Rodriguez y Damian Saban.Jueves, viernes y sabados | 18 h |&nbsp;Hall Alfredo Alcon del&nbsp;Teatro San Martin (Av Corrientes 1530)Entrada libre y gratuita (hasta agotar la capacidad del lugar)
802	Orquesta ​Baires Sinfonica	https://disfrutemosba.buenosaires.gob.ar/lugares/orquesta-baires-sinfonica	NULL	NULL	NULL	NULL	NULL	La Orquesta Baires Sinfonica, bajo la direccion de Jorge Manfredini, realizara su ciclo de conciertos a desarrollarse en el Salon Dorado de la Casa de la Cultura. Un Concierto Clasico y popular que cuenta con&nbsp;25 musicos en escena y la participacion del tenor Lucia Marchetti y el soprano Luis Cejas. Ademas de los Maestros Marcelo Cambiasso y Cesar Vera de Miguel.Sabado 06 de agosto | 18hSalon Dorado de la Casa de la Cultura |Av. De Mayo 575, CABAEntrada libre y gratuita------------------------------------------------------------------------------------------------------------------------------------------La Orquesta BAIRES SINFONICA, Anteriormente llamada “Camerata Baires”, nace hace unos 25 anos como un proyecto de J. Manfredini, recientemente graduado en la carrera de direccion orquestal; y un grupo de jovenes profesionales y estudiantes de musica, con el nombre original de “ORQUESTA DE CAMARA DEL PLATA” asi tambien como aficionados y amateurs de gran nivel musical que deciden formar un nuevo grupo musical independiente y auto gestionado con repertorio clasico y barroco, que combina desde un principio lo sinfonico, lirico, el tango, el folclore nacional y las composiciones nuevas de jovenes compositores y arregladores. Luego de diversas actuaciones, debutaran oficialmente en la Feria del Libro y de alli participan en diversas entidades culturales como museos, universidades y colegios de Capital hasta que en 1991/92 realizan conciertos en el Teatro Colon de Buenos Aires junto a destacados coros y solistas liricos e instrumentales. Asi mismo acompanan innumerables espectaculos liricos de opera, zarzuela y ballet, tanto en Buenos Aires como en el interior del pais junto a diversas companias liricas.Tras algunos anos de actuaciones interrumpidas vuelven junto al Maestro Luis Cejas(Cantante, instrumentista y director) a acompanar espectaculos de zarzuela y opera en varias salas importantes de Capital, Lujan, Bernal y otros sitios de la provincia de Bs. As., celebran su 30º Aniversario en el Teatro Colonial (lugar que practicamente los ve nacer), Museo de Arte Moderno de Lujan, Manzana de las luces, Teatro El Vitral, etc. Posteriores lugares son Facultad de Derecho, Centro de Comerciantes de Lanus, diversas Iglesias y templos, Federacion Espanola, Centro Naval, Centro Italianoy otros.Posteriormente cambia su nombre por Camerata Baires, para convertirse en 2014 en BAIRES SINFONICA, completando todas las filas instrumentales de cuerdas, vientos y percusion, mas teclado, subdirector y directores invitados y asi abarcar todo el repertorios que incluye el Romanticismo y el Siglo XX, asi tambien como musica de peliculas y comedia musical.Programan actuaciones en salas teatrales de todo Capital, gran Buenos Aires e interior del pais. Incluso en aquellos recintos donde nunca ha actuado orquesta alguna. Actualmenterealizan un variado programa con la participacion de cantantes liricos y bailarines frecuentando como siempre todos los generos universales de la musica, incluso con adaptaciones y orquestaciones propias y repertorios exclusivos.Los actuales directores adjuntos son Marcelo Cambiasso y Cesar Vera de Miguel. Si bien es una entidad sin fines de lucro, realiza habitualmente presentaciones con cobro de entradas para solventar gastos (sala de ensayo, impresion de programas, difusion, afiches, etc.). Esencialmente no es un organismo rentado o dependiente de algun organismo oficial o privado y decide por si mismo las actuaciones y programas a gestionar. Tampoco descartan las giras o viajes al interior y exterior del pais, como ha sido en sus principios.
803	Son Tus Museos | Artes Visuales	https://disfrutemosba.buenosaires.gob.ar/lugares/son-tus-museos-artes-visuales	NULL	NULL	Museos y Galerias	NULL	NULL	El Buenos Aires Museo presenta los artistas seleccionados de la convocatoria federal Son Tus Museos | Artes Visuales, lanzada el pasado 18 de mayo. Se inscribieron mas de 140 artistas de todo el pais de los que se seleccionaron a tres que realizaran una muestra individual en la ciudad de Buenos Aires. El BAM sera anfitrion de los artistas elegidos: Daniela Arnaudo de la provincia de Santa Fe, Franco Martin Contreras de la provincia de Mendoza y Ana Benedetti de la provincia de Salta. En la convocatoria participaron las disciplinas Pintura, Dibujo, Escultura, Instalacion, Textil, Fotografia, Videoarte y Artes graficas. El objetivo de la convocatoria federal es posibilitar el reconocimiento al talento de artistas de todo el pais y brindarles herramientas para mostrar su trabajo en una exposicion individual en la ciudad de Buenos Aires. Las tres propuestas se exhibiran entre agosto de 2022 y marzo de 2023. Cada exposicion estara acompanada por un Programa de Actividades Publicas cuyo objetivo es el relacionamiento de los participantes con la comunidad y con el sector artistico de la ciudad de Buenos Aires. El Programa consistira en talleres, charlas, clases y otras actividades a ser propuestas por los artistas, abiertas a la comunidad.11 a 19h | Martes cerradosAgosto de 2022 a marzo de 2023Buenos Aires Museo | Defensa 187
